{"approvals":{"APPROVE_BUILD_CHARTER":"24702581f21303db66c70876f8b9c79ee5de3c0720117260268b328b70cae291"},"consequentialAuthorityGranted":false,"documentType":"clover-launch-session","eventCount":10,"externalEffects":[],"fixtureHash":"db20824bc159e2794c35331c317141b3f4ef6793001289d60be2cee3042210c4","headEventHash":"6527aeb1edfca8893407d7058cd0f9e92586bd5cecfd7a2dd449aa15edea5ba4","personalChatGptMemoryStored":false,"profileId":"launch_profile_idea_001","projectId":"project_synthetic_activity_chooser_001","resolvedModels":[],"schemaVersion":"0.1.0","sessionId":"launch_session_synthetic_owner_001","sessionVersion":10,"sharedTruthAutomaticallyPromoted":false,"state":"held","synthetic":true,"workspaceId":"workspace_synthetic_retreat_001"}
